{
  "schema_version": 1,
  "dataset_id": "pronunciation_progression_strands",
  "version": 1,
  "level_order": [
    "a1",
    "a2",
    "b1",
    "b2",
    "c1",
    "c2"
  ],
  "inputs": [
    {
      "path": "data/reviewed/source-dispositions-v1.json",
      "sha256": "15824d8281d9e6669eddc40780e3f9ab3113866834c7fae997b2de76bf92a32d"
    },
    {
      "path": "data/reviewed/level-exit-profiles-v1.json",
      "sha256": "8cd53270688f6aafadddb7beb7f8f3717d832a464f127fefd3def3a1a62da30a"
    },
    {
      "path": "docs/DECISIONS.md",
      "sha256": "17a098d45b54b4fb26d0db02cf383b156a843e78414aa756c510cbbeccc819ca"
    }
  ],
  "target_model": {
    "teaching_reference": "General American pronunciation for models and IPA",
    "success_standard": "intelligible effective meaning with level-appropriate listener effort and repair",
    "accent_policy": "A retained accent is acceptable whenever intelligibility and effectiveness are preserved.",
    "non_goals": [
      "accent removal",
      "native-speaker imitation",
      "one mandatory learner accent"
    ]
  },
  "evidence_contract": {
    "cefr_role": "exit_intelligibility_boundary",
    "english_sequence_role": "reviewed_product_decision_not_claimed_as_cefr_sequence",
    "arabic_risk_role": "hypothesis_pending_specialist_and_learner_validation"
  },
  "strands": [
    {
      "strand_id": "pronunciation.sound_perception",
      "strand_code": "sound_perception",
      "title": "Sound perception and word recognition",
      "prerequisite_strand_ids": [],
      "first_guided_productive_level": "a1",
      "first_family_consolidation_level": "a2",
      "stages": [
        {
          "level": "a1",
          "expectation": "Distinguish selected high-value sounds, word boundaries, names, numbers, and learnt chunks in very clear speech.",
          "exit_boundary": "A limited learnt repertoire is intelligible with effort and collaborative support.",
          "profile_claim_id": "a1.language_control.pronunciation",
          "control_focus": "both",
          "lifecycle_states": [
            "introduce",
            "practise"
          ],
          "cefr_boundary_evidence_count": 4,
          "cefr_boundary_evidence_ids_sha256": "3bd14b1c1ecc9070e44d20be4a228e1c3dc914572af825b275fc4aede83f9d29",
          "representative_cefr_evidence_ids": [
            "cefr.cv2020.p135.a1.overall_phonological_control.001",
            "cefr.cv2020.p135.a1.sound_articulation.001",
            "cefr.cv2020.p135.a1.sound_articulation.002"
          ],
          "evidence_role": "level_boundary_not_sequence_proof"
        },
        {
          "level": "a2",
          "expectation": "Recognise selected contrasts and familiar words across routine voices and generally clear delivery.",
          "exit_boundary": "Generally understandable in familiar situations, though repetition and listener effort may be needed.",
          "profile_claim_id": "a2.language_control.pronunciation",
          "control_focus": "both",
          "lifecycle_states": [
            "recycle",
            "consolidate"
          ],
          "cefr_boundary_evidence_count": 5,
          "cefr_boundary_evidence_ids_sha256": "f081a93ed8657980480f2fda01589ab207901bdc10830113fcfc785a6ed3cdff",
          "representative_cefr_evidence_ids": [
            "cefr.cv2020.p135.a2.overall_phonological_control.001",
            "cefr.cv2020.p135.a2.prosodic_features.002",
            "cefr.cv2020.p135.a2.sound_articulation.002"
          ],
          "evidence_role": "level_boundary_not_sequence_proof"
        },
        {
          "level": "b1",
          "expectation": "Use phonological cues to recognise familiar connected speech despite regular variation and first-language influence.",
          "exit_boundary": "Generally intelligible despite regular mispronunciation and noticeable first-language influence.",
          "profile_claim_id": "b1.language_control.pronunciation",
          "control_focus": "both",
          "lifecycle_states": [
            "recycle",
            "extend"
          ],
          "cefr_boundary_evidence_count": 3,
          "cefr_boundary_evidence_ids_sha256": "39e1386eabf51a04d70fa3f821292432653bee6f3373450fb13d60e620ed7c08",
          "representative_cefr_evidence_ids": [
            "cefr.cv2020.p134.b1.overall_phonological_control.001",
            "cefr.cv2020.p134.b1.prosodic_features.001",
            "cefr.cv2020.p134.b1.sound_articulation.001"
          ],
          "evidence_role": "level_boundary_not_sequence_proof"
        },
        {
          "level": "b2",
          "expectation": "Resolve most sound, stress, and reduction variation in standard familiar and field-related input.",
          "exit_boundary": "Intelligible throughout; accent has little effect and prosody generally supports the intended message.",
          "profile_claim_id": "b2.language_control.pronunciation",
          "control_focus": "both",
          "lifecycle_states": [
            "recycle",
            "extend"
          ],
          "cefr_boundary_evidence_count": 4,
          "cefr_boundary_evidence_ids_sha256": "56b789966f53ca03b059e2856523cbc4638e1393a025928e2d946cabf11d6fc2",
          "representative_cefr_evidence_ids": [
            "cefr.cv2020.p134.b2.overall_phonological_control.001",
            "cefr.cv2020.p134.b2.sound_articulation.001",
            "cefr.cv2020.p134.b2.sound_articulation.002"
          ],
          "evidence_role": "level_boundary_not_sequence_proof"
        },
        {
          "level": "c1",
          "expectation": "Track a full range of phonological cues across accents, speed, register, and complex discourse.",
          "exit_boundary": "Full phonological range with intelligibility throughout; retained accent does not affect effectiveness.",
          "profile_claim_id": "c1.language_control.pronunciation",
          "control_focus": "both",
          "lifecycle_states": [
            "recycle",
            "extend"
          ],
          "cefr_boundary_evidence_count": 4,
          "cefr_boundary_evidence_ids_sha256": "4824dd5a664c4e44c6c37454f99708e7c5abaaf9ca44c5f41864ce9559a05f36",
          "representative_cefr_evidence_ids": [
            "cefr.cv2020.p134.c1.overall_phonological_control.001",
            "cefr.cv2020.p134.c1.prosodic_features.002",
            "cefr.cv2020.p134.c1.sound_articulation.001"
          ],
          "evidence_role": "level_boundary_not_sequence_proof"
        },
        {
          "level": "c2",
          "expectation": "Interpret fine phonological detail, marked delivery, and subtle prosodic meaning across demanding input.",
          "exit_boundary": "Precise articulation and prosody enhance subtle meaning; retained accent does not reduce intelligibility or effectiveness.",
          "profile_claim_id": "c2.language_control.pronunciation",
          "control_focus": "both",
          "lifecycle_states": [
            "recycle",
            "extend"
          ],
          "cefr_boundary_evidence_count": 3,
          "cefr_boundary_evidence_ids_sha256": "2db9ffa36e93974ec5fa28110e9a8bb2614604b18bcdeaa757f089f5f172b658",
          "representative_cefr_evidence_ids": [
            "cefr.cv2020.p134.c2.overall_phonological_control.001",
            "cefr.cv2020.p134.c2.prosodic_features.001",
            "cefr.cv2020.p134.c2.sound_articulation.001"
          ],
          "evidence_role": "level_boundary_not_sequence_proof"
        }
      ],
      "review": {
        "status": "accepted_internal_v1",
        "basis": "cefr_boundary_plus_english_specific_intelligibility_product_decision"
      }
    },
    {
      "strand_id": "pronunciation.consonant_clarity",
      "strand_code": "consonant_clarity",
      "title": "Consonant contrasts and place or manner clarity",
      "prerequisite_strand_ids": [
        "pronunciation.sound_perception"
      ],
      "first_guided_productive_level": "a1",
      "first_family_consolidation_level": "b1",
      "stages": [
        {
          "level": "a1",
          "expectation": "Produce selected high-impact consonant contrasts clearly enough in names, numbers, key nouns, verbs, and chunks.",
          "exit_boundary": "A limited learnt repertoire is intelligible with effort and collaborative support.",
          "profile_claim_id": "a1.language_control.pronunciation",
          "control_focus": "both",
          "lifecycle_states": [
            "introduce",
            "practise"
          ],
          "cefr_boundary_evidence_count": 4,
          "cefr_boundary_evidence_ids_sha256": "3bd14b1c1ecc9070e44d20be4a228e1c3dc914572af825b275fc4aede83f9d29",
          "representative_cefr_evidence_ids": [
            "cefr.cv2020.p135.a1.overall_phonological_control.001",
            "cefr.cv2020.p135.a1.sound_articulation.001",
            "cefr.cv2020.p135.a1.sound_articulation.002"
          ],
          "evidence_role": "level_boundary_not_sequence_proof"
        },
        {
          "level": "a2",
          "expectation": "Maintain selected contrasts in routine phrases and short sentences, with repetition available when needed.",
          "exit_boundary": "Generally understandable in familiar situations, though repetition and listener effort may be needed.",
          "profile_claim_id": "a2.language_control.pronunciation",
          "control_focus": "both",
          "lifecycle_states": [
            "recycle",
            "practise"
          ],
          "cefr_boundary_evidence_count": 5,
          "cefr_boundary_evidence_ids_sha256": "f081a93ed8657980480f2fda01589ab207901bdc10830113fcfc785a6ed3cdff",
          "representative_cefr_evidence_ids": [
            "cefr.cv2020.p135.a2.overall_phonological_control.001",
            "cefr.cv2020.p135.a2.prosodic_features.002",
            "cefr.cv2020.p135.a2.sound_articulation.002"
          ],
          "evidence_role": "level_boundary_not_sequence_proof"
        },
        {
          "level": "b1",